A new study created in memory with name: ST002000-MetaboliteVAE-Hyperparameter-Tuning
Trial 0 finished with value: 0.4294539197367065 and parameters: {'optimizer': 'SGD', 'learning_rate': 0.0007825079936887789, 'latent_dim': 34}. Best is trial 0 with value: 0.4294539197367065.
Trial 1 finished with value: 0.4237751132067369 and parameters: {'optimizer': 'Adam', 'learning_rate': 0.0009784775631977141, 'latent_dim': 17}. Best is trial 1 with value: 0.4237751132067369.
Trial 2 finished with value: 0.42394639642871157 and parameters: {'optimizer': 'Adam', 'learning_rate': 0.000648896632487554, 'latent_dim': 14}. Best is trial 1 with value: 0.4237751132067369.
Trial 3 finished with value: 0.42524859689328137 and parameters: {'optimizer': 'Adam', 'learning_rate': 7.82439972745335e-05, 'latent_dim': 39}. Best is trial 1 with value: 0.4237751132067369.
Trial 4 finished with value: 2.7358806814466203 and parameters: {'optimizer': 'SGD', 'learning_rate': 1.1865021690306197e-05, 'latent_dim': 32}. Best is trial 1 with value: 0.4237751132067369.
Trial 5 finished with value: 0.42385412448522997 and parameters: {'optimizer': 'Adam', 'learning_rate': 0.0003382942337805375, 'latent_dim': 13}. Best is trial 1 with value: 0.4237751132067369.
Trial 6 finished with value: 0.42772221717299247 and parameters: {'optimizer': 'Adam', 'learning_rate': 3.820170027919008e-05, 'latent_dim': 31}. Best is trial 1 with value: 0.4237751132067369.
Trial 7 finished with value: 0.42414192596868594 and parameters: {'optimizer': 'Adam', 'learning_rate': 0.00043355898019222113, 'latent_dim': 29}. Best is trial 1 with value: 0.4237751132067369.
Trial 8 finished with value: 0.4332295951186394 and parameters: {'optimizer': 'SGD', 'learning_rate': 0.00043708785625701664, 'latent_dim': 33}. Best is trial 1 with value: 0.4237751132067369.
Trial 9 finished with value: 0.4239485361138169 and parameters: {'optimizer': 'Adam', 'learning_rate': 0.00024449573093625484, 'latent_dim': 22}. Best is trial 1 with value: 0.4237751132067369.
Trial 10 finished with value: 0.42999870360505826 and parameters: {'optimizer': 'SGD', 'learning_rate': 0.0009888540034047413, 'latent_dim': 48}. Best is trial 1 with value: 0.4237751132067369.
Trial 11 finished with value: 0.4237966283547635 and parameters: {'optimizer': 'Adam', 'learning_rate': 0.0009762631344999685, 'latent_dim': 7}. Best is trial 1 with value: 0.4237751132067369.
Trial 12 finished with value: 0.4237612469159827 and parameters: {'optimizer': 'Adam', 'learning_rate': 0.0009754125565970963, 'latent_dim': 5}. Best is trial 12 with value: 0.4237612469159827.
Trial 13 finished with value: 0.4238371078153046 and parameters: {'optimizer': 'Adam', 'learning_rate': 0.000798623396734218, 'latent_dim': 5}. Best is trial 12 with value: 0.4237612469159827.
Trial 14 finished with value: 0.4239403827458012 and parameters: {'optimizer': 'Adam', 'learning_rate': 0.0008320684523101345, 'latent_dim': 20}. Best is trial 12 with value: 0.4237612469159827.
