A new study created in memory with name: ST001517-MetaboliteVAE-Hyperparameter-Tuning
Trial 0 finished with value: 0.47434876999765074 and parameters: {'optimizer': 'Adam', 'learning_rate': 6.85041220312878e-05, 'latent_dim': 27}. Best is trial 0 with value: 0.47434876999765074.
Trial 1 finished with value: 0.48125780640908006 and parameters: {'optimizer': 'SGD', 'learning_rate': 0.0009764740734573665, 'latent_dim': 17}. Best is trial 0 with value: 0.47434876999765074.
Trial 2 finished with value: 0.48503145406830983 and parameters: {'optimizer': 'SGD', 'learning_rate': 0.000873095382848359, 'latent_dim': 34}. Best is trial 0 with value: 0.47434876999765074.
Trial 3 finished with value: 0.47309063346880786 and parameters: {'optimizer': 'Adam', 'learning_rate': 0.00019201578342178529, 'latent_dim': 29}. Best is trial 3 with value: 0.47309063346880786.
Trial 4 finished with value: 0.481528565568744 and parameters: {'optimizer': 'SGD', 'learning_rate': 0.0005609030075832093, 'latent_dim': 7}. Best is trial 3 with value: 0.47309063346880786.
Trial 5 finished with value: 0.4739121963393013 and parameters: {'optimizer': 'Adam', 'learning_rate': 0.0002745451581292585, 'latent_dim': 29}. Best is trial 3 with value: 0.47309063346880786.
Trial 6 finished with value: 0.4730444589875779 and parameters: {'optimizer': 'Adam', 'learning_rate': 0.0005632857292878684, 'latent_dim': 38}. Best is trial 6 with value: 0.4730444589875779.
Trial 7 finished with value: 0.4729180454083209 and parameters: {'optimizer': 'Adam', 'learning_rate': 0.0006557262402118153, 'latent_dim': 34}. Best is trial 7 with value: 0.4729180454083209.
Trial 8 finished with value: 0.48672249238446075 and parameters: {'optimizer': 'SGD', 'learning_rate': 0.0003426022802643537, 'latent_dim': 28}. Best is trial 7 with value: 0.4729180454083209.
Trial 9 finished with value: 0.4821976805632969 and parameters: {'optimizer': 'SGD', 'learning_rate': 0.0008718883446670522, 'latent_dim': 9}. Best is trial 7 with value: 0.4729180454083209.
Trial 10 finished with value: 0.4736280030799362 and parameters: {'optimizer': 'Adam', 'learning_rate': 0.0006972329575304229, 'latent_dim': 46}. Best is trial 7 with value: 0.4729180454083209.
Trial 11 finished with value: 0.47309674294489734 and parameters: {'optimizer': 'Adam', 'learning_rate': 0.0005256100854208808, 'latent_dim': 44}. Best is trial 7 with value: 0.4729180454083209.
Trial 12 finished with value: 0.47333870069035944 and parameters: {'optimizer': 'Adam', 'learning_rate': 0.0006163044812904265, 'latent_dim': 38}. Best is trial 7 with value: 0.4729180454083209.
Trial 13 finished with value: 0.4731711745262146 and parameters: {'optimizer': 'Adam', 'learning_rate': 0.0004445092202362874, 'latent_dim': 38}. Best is trial 7 with value: 0.4729180454083209.
Trial 14 finished with value: 0.47275983443800007 and parameters: {'optimizer': 'Adam', 'learning_rate': 0.0007070725835041293, 'latent_dim': 20}. Best is trial 14 with value: 0.47275983443800007.
