A new study created in memory with name: ST001736-MetaboliteVAE-Hyperparameter-Tuning
Trial 0 finished with value: 0.4858451584974925 and parameters: {'optimizer': 'Adam', 'learning_rate': 0.000862784322577511, 'latent_dim': 31}. Best is trial 0 with value: 0.4858451584974925.
Trial 1 finished with value: 0.4851963181121677 and parameters: {'optimizer': 'Adam', 'learning_rate': 0.0008995345093119415, 'latent_dim': 8}. Best is trial 1 with value: 0.4851963181121677.
Trial 2 finished with value: 0.5032105428331038 and parameters: {'optimizer': 'SGD', 'learning_rate': 0.0002695696267312888, 'latent_dim': 37}. Best is trial 1 with value: 0.4851963181121677.
Trial 3 finished with value: 0.4941927887061063 and parameters: {'optimizer': 'SGD', 'learning_rate': 0.0007311443705175871, 'latent_dim': 12}. Best is trial 1 with value: 0.4851963181121677.
Trial 4 finished with value: 0.48583516478538513 and parameters: {'optimizer': 'Adam', 'learning_rate': 0.000187299787924867, 'latent_dim': 30}. Best is trial 1 with value: 0.4851963181121677.
Trial 5 finished with value: 0.5078351521024517 and parameters: {'optimizer': 'SGD', 'learning_rate': 0.0002105553268618501, 'latent_dim': 19}. Best is trial 1 with value: 0.4851963181121677.
Trial 6 finished with value: 0.5877525093508702 and parameters: {'optimizer': 'SGD', 'learning_rate': 0.0001371790057423076, 'latent_dim': 41}. Best is trial 1 with value: 0.4851963181121677.
Trial 7 finished with value: 0.5708260834217072 and parameters: {'optimizer': 'SGD', 'learning_rate': 0.00012542732510227038, 'latent_dim': 26}. Best is trial 1 with value: 0.4851963181121677.
Trial 8 finished with value: 0.4963408317051682 and parameters: {'optimizer': 'SGD', 'learning_rate': 0.0009330866714123071, 'latent_dim': 31}. Best is trial 1 with value: 0.4851963181121677.
Trial 9 finished with value: 0.48543591417518317 and parameters: {'optimizer': 'Adam', 'learning_rate': 0.00028335870159685873, 'latent_dim': 22}. Best is trial 1 with value: 0.4851963181121677.
Trial 10 finished with value: 0.48510748498580036 and parameters: {'optimizer': 'Adam', 'learning_rate': 0.0006056606175836373, 'latent_dim': 6}. Best is trial 10 with value: 0.48510748498580036.
Trial 11 finished with value: 0.4851013535962385 and parameters: {'optimizer': 'Adam', 'learning_rate': 0.0006286966951245964, 'latent_dim': 5}. Best is trial 11 with value: 0.4851013535962385.
Trial 12 finished with value: 0.485144341693205 and parameters: {'optimizer': 'Adam', 'learning_rate': 0.0005734096772097017, 'latent_dim': 5}. Best is trial 11 with value: 0.4851013535962385.
Trial 13 finished with value: 0.4853874602738549 and parameters: {'optimizer': 'Adam', 'learning_rate': 0.0005245474361358122, 'latent_dim': 14}. Best is trial 11 with value: 0.4851013535962385.
Trial 14 finished with value: 0.4860854093350616 and parameters: {'optimizer': 'Adam', 'learning_rate': 0.0006481557315797129, 'latent_dim': 50}. Best is trial 11 with value: 0.4851013535962385.
